{
  "protocol_version": "avcs_trigger_eligibility_protocol_v0.2",
  "vulnerability_id": "GHSA-ffqj-6fqr-9h24",
  "aliases": [
    "CVE-2022-29217",
    "PYSEC-2022-202"
  ],

  "status": "eligible",

  "matched_supported_rule_kinds": [
    "keyword_call_condition"
  ],

  "candidate_rule_kinds": [
    "keyword_call_condition"
  ],

  "trigger_coverage": {
    "coverage_status": "full",
    "affected_version_scope": ">=1.5.0,<2.4.0",
    "assessed_trigger_version_scope": ">=1.5.0,<2.4.0",
    "uncovered_scope_note": null
  },

  "eligibility_checks": {
    "vulnerability_identity": "pass",
    "affected_version_range": "pass",
    "upstream_trigger_semantics": "pass",
    "supported_static_expressibility": "pass",
    "counterfactual_validation": "pass",
    "provenance_completeness": "pass"
  },

  "review_required": false,

  "rule_refs": [
    "pyjwt_decode_default_algorithms_call"
  ],

  "evidence_refs": [
    "osv_ghsa_ffqj_6fqr_9h24",
    "pysec_2022_202",
    "pyjwt_upstream_advisory",
    "pyjwt_fix_commit",
    "pyjwt_2_4_0_changelog",
    "output/avcs_pyjwt_api_history_evidence_fully_auto_v0.json",
    "output/pyjwt_ghsa_ffqj_6fqr_9h24_trigger_evidence_v0.json"
  ],

  "unsupported_reasons": [],

  "positive_regression_refs": [
    "output/pyjwt_default_algorithms_true_evaluation_v0.json"
  ],

  "negative_regression_refs": [
    "output/pyjwt_explicit_algorithms_false_evaluation_v0.json"
  ],

  "decision_notes": "The affected range and the assessed Trigger semantics both cover >=1.5.0,<2.4.0. Upstream advisory and fix evidence support the selected jwt.decode algorithms configuration semantics. The static condition is expressible as keyword_call_condition: jwt.decode(..., algorithms=jwt.algorithms.get_default_algorithms()). API availability evidence remains separate from vulnerability-range evidence.",

  "review": {
    "status": "approved",
    "reviewer": null,
    "reviewed_at": null,
    "notes": "Migrated from the existing curated and regression-validated PyJWT real case. Exact historical reviewer identity and review timestamp are not asserted by this migration artifact."
  }
}